{
  "schemaVersion": "1.1.0",
  "contractKind": "screen-intake",
  "setId": "set-a",
  "surfaceId": "create-room-modal",
  "surfaceRole": "independent",
  "status": "accepted",
  "source": {
    "tool": "stitch",
    "screenName": "create-room-modal",
    "sourceRef": "set-a-create-room-modal",
    "variantLabel": "accepted create flow"
  },
  "familyHints": {
    "suggestedBlueprintId": "overlay-modal",
    "suggestedFeatureArea": "lobby",
    "likelyOverlay": true,
    "likelyScrollRoot": false,
    "repeatedBlockIds": []
  },
  "blocks": [
    {
      "blockId": "overlay-root",
      "role": "overlay",
      "sourceName": "LobbyCreateRoomScrim",
      "layout": {
        "axis": "overlay",
        "padding": 16,
        "gap": 16,
        "minHeight": 0,
        "minWidth": 0,
        "alignment": "stretch",
        "sticky": true,
        "scroll": false
      },
      "children": [
        "overlay-card"
      ],
      "required": true,
      "repeat": false,
      "notes": [
        "Lobby context remains visible behind the create room modal."
      ]
    },
    {
      "blockId": "overlay-card",
      "role": "content",
      "sourceName": "CreateRoomCard",
      "layout": {
        "axis": "vertical",
        "padding": 16,
        "gap": 12,
        "minHeight": 0,
        "minWidth": 0,
        "alignment": "stretch",
        "sticky": false,
        "scroll": false
      },
      "children": [
        "room-name-field",
        "squad-size-controls",
        "privacy-controls",
        "action-row"
      ],
      "required": true,
      "repeat": false,
      "notes": [
        "Centered or lower-centered tactical modal with room name, squad size, and privacy/access controls.",
        "Integrated with populated lobby context, not a full-page replacement."
      ]
    },
    {
      "blockId": "room-name-field",
      "role": "content",
      "sourceName": "RoomNameField",
      "layout": {
        "axis": "vertical",
        "padding": 0,
        "gap": 0,
        "minHeight": 0,
        "minWidth": 0,
        "alignment": "stretch",
        "sticky": false,
        "scroll": false
      },
      "children": [],
      "required": true,
      "repeat": false,
      "notes": [
        "Room naming input is part of first interaction setup."
      ]
    },
    {
      "blockId": "squad-size-controls",
      "role": "section",
      "sourceName": "SquadSizeControls",
      "layout": {
        "axis": "horizontal",
        "padding": 0,
        "gap": 8,
        "minHeight": 0,
        "minWidth": 0,
        "alignment": "stretch",
        "sticky": false,
        "scroll": false
      },
      "children": [],
      "required": true,
      "repeat": false,
      "notes": [
        "Squad size is compact and immediately adjustable."
      ]
    },
    {
      "blockId": "privacy-controls",
      "role": "section",
      "sourceName": "PrivacyControls",
      "layout": {
        "axis": "horizontal",
        "padding": 0,
        "gap": 8,
        "minHeight": 0,
        "minWidth": 0,
        "alignment": "stretch",
        "sticky": false,
        "scroll": false
      },
      "children": [],
      "required": true,
      "repeat": false,
      "notes": [
        "Privacy/access controls stay compact instead of expanding into a full settings page."
      ]
    },
    {
      "blockId": "action-row",
      "role": "section",
      "sourceName": "CreateRoomActions",
      "layout": {
        "axis": "horizontal",
        "padding": 0,
        "gap": 8,
        "minHeight": 0,
        "minWidth": 0,
        "alignment": "stretch",
        "sticky": false,
        "scroll": false
      },
      "children": [
        "confirm-create-room",
        "cancel-create-room"
      ],
      "required": true,
      "repeat": false,
      "notes": [
        "Primary create action remains louder than cancel."
      ]
    },
    {
      "blockId": "confirm-create-room",
      "role": "cta",
      "sourceName": "CreateRoomAction",
      "layout": {
        "axis": "horizontal",
        "padding": 0,
        "gap": 8,
        "minHeight": 0,
        "minWidth": 0,
        "alignment": "stretch",
        "sticky": false,
        "scroll": false
      },
      "children": [],
      "required": true,
      "repeat": false,
      "notes": [
        "Primary create action uses signal-orange emphasis."
      ]
    },
    {
      "blockId": "cancel-create-room",
      "role": "cta",
      "sourceName": "CancelCreateRoomAction",
      "layout": {
        "axis": "horizontal",
        "padding": 0,
        "gap": 8,
        "minHeight": 0,
        "minWidth": 0,
        "alignment": "stretch",
        "sticky": false,
        "scroll": false
      },
      "children": [],
      "required": true,
      "repeat": false,
      "notes": [
        "Secondary dismiss action."
      ]
    }
  ],
  "ctaPriority": [
    {
      "id": "confirm-create-room",
      "priority": "primary",
      "label": "Create Room",
      "outcome": "create room",
      "placement": "footer",
      "notes": [
        "Primary create action stays louder than cancel."
      ]
    },
    {
      "id": "cancel-create-room",
      "priority": "secondary",
      "label": "Cancel",
      "outcome": "dismiss create room modal",
      "placement": "footer",
      "notes": [
        "Secondary dismissal action."
      ]
    }
  ],
  "states": {
    "default": true,
    "empty": false,
    "loading": false,
    "error": true,
    "selected": false,
    "disabled": true
  },
  "validation": {
    "frame": "390x844",
    "firstReadOrder": [
      "overlay-card",
      "room-name-field",
      "squad-size-controls",
      "privacy-controls",
      "confirm-create-room",
      "cancel-create-room"
    ],
    "requiredChecks": [
      "lobby visible behind scrim",
      "compact room name, squad size, privacy controls",
      "primary create action clearer than cancel"
    ]
  },
  "notes": [
    "Focused auxiliary overlay on top of populated lobby.",
    "Avoid generic app dialog styling."
  ],
  "openQuestions": []
}
