{
  "schemaVersion": "1.1.0",
  "contractKind": "screen-intake",
  "setId": "set-b",
  "surfaceId": "garage-main-workspace",
  "surfaceRole": "root",
  "status": "accepted",
  "source": {
    "tool": "stitch",
    "screenName": "garage-main-workspace",
    "sourceRef": "set-b-garage-main-workspace",
    "variantLabel": "accepted baseline workspace"
  },
  "familyHints": {
    "suggestedBlueprintId": "garage-workspace",
    "suggestedFeatureArea": "garage",
    "likelyOverlay": false,
    "likelyScrollRoot": true,
    "repeatedBlockIds": [
      "slot-selector"
    ]
  },
  "blocks": [
    {
      "blockId": "garage-root",
      "role": "root",
      "sourceName": "GarageMainWorkspace",
      "layout": {
        "axis": "vertical",
        "padding": 16,
        "gap": 16,
        "minHeight": 0,
        "minWidth": 0,
        "alignment": "stretch",
        "sticky": false,
        "scroll": false
      },
      "children": [
        "garage-header-row",
        "slot-selector",
        "focus-bar",
        "focused-editor",
        "preview-card",
        "summary-card",
        "save-dock"
      ],
      "required": true,
      "repeat": false,
      "notes": [
        "Single scroll workspace, not fragmented dashboard panels.",
        "Korean-first compact tactical card stack with strong navy panels and one dominant orange save dock."
      ]
    },
    {
      "blockId": "garage-header-row",
      "role": "section",
      "sourceName": "GarageHeaderRow",
      "layout": {
        "axis": "horizontal",
        "padding": 0,
        "gap": 12,
        "minHeight": 0,
        "minWidth": 0,
        "alignment": "stretch",
        "sticky": false,
        "scroll": false
      },
      "children": [],
      "required": true,
      "repeat": false,
      "notes": [
        "Top area stays compact: title, current roster context, settings access only.",
        "Settings stays a quiet gear action in the top-right corner, not a large secondary button."
      ]
    },
    {
      "blockId": "slot-selector",
      "role": "section",
      "sourceName": "SlotSelector",
      "layout": {
        "axis": "horizontal",
        "padding": 0,
        "gap": 8,
        "minHeight": 0,
        "minWidth": 0,
        "alignment": "stretch",
        "sticky": false,
        "scroll": false
      },
      "children": [],
      "required": true,
      "repeat": true,
      "notes": [
        "Slot selector is the first major read and must be visible before the editor body dominates.",
        "This is a horizontal four-card strip, not a vertical roster list.",
        "The selected slot card must visually outrank the empty cards before the editor body starts."
      ]
    },
    {
      "blockId": "focus-bar",
      "role": "section",
      "sourceName": "PartFocusBar",
      "layout": {
        "axis": "horizontal",
        "padding": 0,
        "gap": 8,
        "minHeight": 0,
        "minWidth": 0,
        "alignment": "stretch",
        "sticky": false,
        "scroll": false
      },
      "children": [],
      "required": true,
      "repeat": false,
      "notes": [
        "Focus bar switches the currently active editing area.",
        "Three compact chips sit directly under the slot strip and keep the active focus clearly highlighted."
      ]
    },
    {
      "blockId": "focused-editor",
      "role": "content",
      "sourceName": "FocusedEditor",
      "layout": {
        "axis": "vertical",
        "padding": 16,
        "gap": 12,
        "minHeight": 0,
        "minWidth": 0,
        "alignment": "stretch",
        "sticky": false,
        "scroll": false
      },
      "children": [],
      "required": true,
      "repeat": false,
      "notes": [
        "Current active work area for frame, weapon, or mobility focus.",
        "This is the dominant block in the scroll body.",
        "The first-screen editor card should already look finished: selected part title, strong primary stat, supporting stat row, and quiet auxiliary action."
      ]
    },
    {
      "blockId": "preview-card",
      "role": "content",
      "sourceName": "PreviewCard",
      "layout": {
        "axis": "vertical",
        "padding": 16,
        "gap": 8,
        "minHeight": 0,
        "minWidth": 0,
        "alignment": "stretch",
        "sticky": false,
        "scroll": false
      },
      "children": [],
      "required": true,
      "repeat": false,
      "notes": [
        "Preview must look finished, not placeholder-like.",
        "Use a framed blueprint viewer with a visible bottom meter so the surface still reads as evaluative even when model detail is sparse."
      ]
    },
    {
      "blockId": "summary-card",
      "role": "status",
      "sourceName": "SummaryCard",
      "layout": {
        "axis": "vertical",
        "padding": 16,
        "gap": 8,
        "minHeight": 0,
        "minWidth": 0,
        "alignment": "stretch",
        "sticky": false,
        "scroll": false
      },
      "children": [],
      "required": true,
      "repeat": false,
      "notes": [
        "Summarize role, attack style, range, durability, and mobility outcome in short Korean labels.",
        "Use compact stat rows or chips rather than loose placeholder copy."
      ]
    },
    {
      "blockId": "save-dock",
      "role": "cta",
      "sourceName": "SaveDock",
      "layout": {
        "axis": "horizontal",
        "padding": 12,
        "gap": 8,
        "minHeight": 0,
        "minWidth": 0,
        "alignment": "stretch",
        "sticky": true,
        "scroll": false
      },
      "children": [],
      "required": true,
      "repeat": false,
      "notes": [
        "Persistent primary CTA using Signal Orange.",
        "Save dock is a full-width orange bottom bar with a lock icon and Korean label, stronger than any inline editor action."
      ]
    }
  ],
  "ctaPriority": [
    {
      "id": "save-roster",
      "priority": "primary",
      "label": "저장 및 배치",
      "outcome": "save roster",
      "placement": "footer",
      "notes": [
        "Strongest persistent CTA in the workspace.",
        "Rendered as a full-width bottom dock, not as a small inline button."
      ]
    },
    {
      "id": "open-settings",
      "priority": "secondary",
      "label": "설정",
      "outcome": "open garage settings overlay",
      "placement": "header",
      "notes": [
        "Auxiliary settings access stays in the compact top row.",
        "Surface reads as a quiet gear action rather than a labeled primary control."
      ]
    }
  ],
  "states": {
    "default": true,
    "empty": true,
    "loading": false,
    "error": true,
    "selected": true,
    "disabled": true
  },
  "validation": {
    "frame": "390x844",
    "firstReadOrder": [
      "slot-selector",
      "focus-bar",
      "focused-editor",
      "preview-card",
      "summary-card",
      "save-dock"
    ],
    "requiredChecks": [
      "slot selector stays a horizontal four-card strip",
      "selected slot card visually outranks empty cards",
      "focus bar stays a compact three-chip row below the slot strip",
      "focused editor first-screen card stays dominant",
      "preview and summary read as finished evaluative cards",
      "save dock remains a full-width Signal Orange persistent CTA",
      "settings stays a quiet gear action"
    ]
  },
  "notes": [
    "Accepted Set B baseline.",
    "Single scroll workspace, not fragmented dashboard panels.",
    "Do not translate this screen into a vertical roster list plus small footer button."
  ],
  "openQuestions": []
}
